{
  "$schema": "../schema.json",
  "title": "Hello World",
  "description": "A minimal HTTP service that answers every request with a greeting. A starting point with no dependencies, built on the Go standard library.",
  "lang": "go",
  "category": "demo",
  "tags": [
    "http",
    "starter"
  ]
}
